{
  "analysis": {
    "container": "webm",
    "crop": {
      "calibration_target": "calibration-all-white",
      "height": 125,
      "width": 800,
      "x": 0,
      "y": 0
    },
    "fps": 30,
    "music_audio_codec": "opus",
    "video_codec": "vp9-lossless"
  },
  "campaign_id": "animation-special-diy-v1",
  "device_baseline": {
    "direct": {
      "brightness_percent": 5,
      "diy_activation_code": 240,
      "power": false
    },
    "vendor_app": {
      "household_light_service": "light.turn_off"
    }
  },
  "schema_version": 1,
  "targets": [
    {
      "audio": {
        "retain_in_reduced": false,
        "stimulus_notes": null
      },
      "batch": "special-diy",
      "brightness_percent": 30,
      "driver": "vendor_app",
      "duration_seconds": 20,
      "family": "special-diy",
      "id": "special-diy-fade-baseline",
      "model": "H6199",
      "operator_steps": [
        "Open DIY, select the named Special Effects template and leave every control at the app default.",
        "Set the palette to red, green and blue where the template exposes colours.",
        "Stop before Apply, return to the terminal, then follow the Apply prompt."
      ],
      "palette": [
        [
          255,
          0,
          0
        ],
        [
          0,
          255,
          0
        ],
        [
          0,
          0,
          255
        ]
      ],
      "parameters": {
        "template": "fade",
        "variation": "app_default"
      },
      "speed_policy": {
        "kind": "app_default"
      }
    },
    {
      "audio": {
        "retain_in_reduced": false,
        "stimulus_notes": null
      },
      "batch": "special-diy",
      "brightness_percent": 30,
      "driver": "vendor_app",
      "duration_seconds": 20,
      "family": "special-diy",
      "id": "special-diy-jumping-baseline",
      "model": "H6199",
      "operator_steps": [
        "Open DIY, select the named Special Effects template and leave every control at the app default.",
        "Set the palette to red, green and blue where the template exposes colours.",
        "Stop before Apply, return to the terminal, then follow the Apply prompt."
      ],
      "palette": [
        [
          255,
          0,
          0
        ],
        [
          0,
          255,
          0
        ],
        [
          0,
          0,
          255
        ]
      ],
      "parameters": {
        "template": "jumping",
        "variation": "app_default"
      },
      "speed_policy": {
        "kind": "app_default"
      }
    },
    {
      "audio": {
        "retain_in_reduced": false,
        "stimulus_notes": null
      },
      "batch": "special-diy",
      "brightness_percent": 30,
      "driver": "vendor_app",
      "duration_seconds": 20,
      "family": "special-diy",
      "id": "special-diy-chasing-baseline",
      "model": "H6199",
      "operator_steps": [
        "Open DIY, select the named Special Effects template and leave every control at the app default.",
        "Set the palette to red, green and blue where the template exposes colours.",
        "Stop before Apply, return to the terminal, then follow the Apply prompt."
      ],
      "palette": [
        [
          255,
          0,
          0
        ],
        [
          0,
          255,
          0
        ],
        [
          0,
          0,
          255
        ]
      ],
      "parameters": {
        "template": "chasing",
        "variation": "app_default"
      },
      "speed_policy": {
        "kind": "app_default"
      }
    },
    {
      "audio": {
        "retain_in_reduced": false,
        "stimulus_notes": null
      },
      "batch": "special-diy",
      "brightness_percent": 30,
      "driver": "vendor_app",
      "duration_seconds": 20,
      "family": "special-diy",
      "id": "special-diy-marquee-baseline",
      "model": "H6199",
      "operator_steps": [
        "Open DIY, select the named Special Effects template and leave every control at the app default.",
        "Set the palette to red, green and blue where the template exposes colours.",
        "Stop before Apply, return to the terminal, then follow the Apply prompt."
      ],
      "palette": [
        [
          255,
          0,
          0
        ],
        [
          0,
          255,
          0
        ],
        [
          0,
          0,
          255
        ]
      ],
      "parameters": {
        "template": "marquee",
        "variation": "app_default"
      },
      "speed_policy": {
        "kind": "app_default"
      }
    },
    {
      "audio": {
        "retain_in_reduced": false,
        "stimulus_notes": null
      },
      "batch": "special-diy",
      "brightness_percent": 30,
      "driver": "vendor_app",
      "duration_seconds": 20,
      "family": "special-diy",
      "id": "special-diy-crossing-baseline",
      "model": "H6199",
      "operator_steps": [
        "Open DIY, select the named Special Effects template and leave every control at the app default.",
        "Set the palette to red, green and blue where the template exposes colours.",
        "Stop before Apply, return to the terminal, then follow the Apply prompt."
      ],
      "palette": [
        [
          255,
          0,
          0
        ],
        [
          0,
          255,
          0
        ],
        [
          0,
          0,
          255
        ]
      ],
      "parameters": {
        "template": "crossing",
        "variation": "app_default"
      },
      "speed_policy": {
        "kind": "app_default"
      }
    },
    {
      "audio": {
        "retain_in_reduced": false,
        "stimulus_notes": null
      },
      "batch": "special-diy",
      "brightness_percent": 30,
      "driver": "vendor_app",
      "duration_seconds": 20,
      "family": "special-diy",
      "id": "special-diy-rainbow-baseline",
      "model": "H6199",
      "operator_steps": [
        "Open DIY, select the named Special Effects template and leave every control at the app default.",
        "Set the palette to red, green and blue where the template exposes colours.",
        "Stop before Apply, return to the terminal, then follow the Apply prompt."
      ],
      "palette": [
        [
          255,
          0,
          0
        ],
        [
          0,
          255,
          0
        ],
        [
          0,
          0,
          255
        ]
      ],
      "parameters": {
        "template": "rainbow",
        "variation": "app_default"
      },
      "speed_policy": {
        "kind": "app_default"
      }
    },
    {
      "audio": {
        "retain_in_reduced": false,
        "stimulus_notes": null
      },
      "batch": "special-diy",
      "brightness_percent": 30,
      "driver": "vendor_app",
      "duration_seconds": 20,
      "family": "special-diy",
      "id": "special-diy-twinkle-baseline",
      "model": "H6199",
      "operator_steps": [
        "Open DIY, select the named Special Effects template and leave every control at the app default.",
        "Set the palette to red, green and blue where the template exposes colours.",
        "Stop before Apply, return to the terminal, then follow the Apply prompt."
      ],
      "palette": [
        [
          255,
          0,
          0
        ],
        [
          0,
          255,
          0
        ],
        [
          0,
          0,
          255
        ]
      ],
      "parameters": {
        "template": "twinkle",
        "variation": "app_default"
      },
      "speed_policy": {
        "kind": "app_default"
      }
    }
  ],
  "viewer": {
    "expected_height": 720,
    "expected_width": 1280,
    "sample_count": 9,
    "sample_interval_seconds": 0.5,
    "session": "govee-camera",
    "stable_seconds": 2.0,
    "url": "https://vdo.ninja/?view=7MdKzqF"
  }
}
